{
  "profile_id": "default_polite",
  "profile_name": "Default Server-Preserving Preservation",
  "description": "Ethical, high-fidelity archival with polite human-cadence delays and dynamic EWMA backoff.",
  "target": {
    "allowed_domains": [
      "example.org"
    ],
    "seed_urls": {
      "tier_1_core": [
        "https://example.org/"
      ],
      "tier_2_breadth": [],
      "tier_3_discovery": []
    },
    "path_whitelist_regex": "",
    "path_blacklist_regex": "/logout|/signin|/signup|/auth|/cgi-bin",
    "asset_extensions": [
      ".pdf",
      ".docx",
      ".xlsx",
      ".pptx",
      ".csv",
      ".zip",
      ".png",
      ".jpg",
      ".svg"
    ],
    "max_depth": 4,
    "max_pages": 2000
  },
  "politeness": {
    "min_delay_ms": 1200,
    "max_delay_ms": 3200,
    "jitter_distribution": "gaussian",
    "max_requests_per_minute": 25,
    "concurrency": 1,
    "burst_limit": 3,
    "respect_retry_after": true,
    "adaptive_ewma_backoff": true,
    "consecutive_error_tripwire": 3,
    "cooldown_seconds": 60
  },
  "archival": {
    "operator": "AegisArchive Preservationist",
    "organization": "Independent Digital Preservation",
    "warc_prefix": "aegis_preservation",
    "deduplicate_payloads": true,
    "generate_cdx": true,
    "enable_opfs_streaming": true
  },
  "taxonomy": [
    {
      "code": "DOC",
      "label": "Official Documentation",
      "keywords": [
        "documentation",
        "guide",
        "manual",
        "handbook"
      ]
    },
    {
      "code": "POL",
      "label": "Policies & Standards",
      "keywords": [
        "policy",
        "standard",
        "governance",
        "charter",
        "procedure"
      ]
    },
    {
      "code": "REP",
      "label": "Reports & Publications",
      "keywords": [
        "report",
        "whitepaper",
        "publication",
        "audit",
        "review"
      ]
    }
  ]
}